Utterance,Emotion
I did. I thought it'd be great. I figured I'd have like time alone with my thoughts but ya know it turns out I don't have as many thoughts as you'd think.,ENERGETIC
Joey why don't you talk to Chandler about moving back?,CALM
I promise you he would definitely want you back.,CALM
I'm telling you there's no way he's moving back.,ENERGETIC
But we had one of the greatest talks we ever had last night. I mean it was it was like when we first started living together.,CALM
Look I know you don't want to hear this right now but we've seen him in his new place alright. And he's happy he's he's decorated.,ENERGETIC
Look Chandler he has moved on OK you have to too.,ENERGETIC
But...,SAD
No. You're just gonna have to accept the fact that you're just friends now OK you're not... rommmates anymore.,ENERGETIC
OK Phoebe you ready to try one?,CALM
They're your backup singers... beind you.,CALM
Alrighty. From the top.,ENERGETIC
Honey uh we we can talk about this. It's just that it's costing about a hundred dollars a minute to be in here.,CALM
Oh OK. So um the cat stinks but you love it let's go.,HAPPY
I was.,CALM
Oh I- Oh wait Tony can you hang on? That's the other line. Hello. Oh yeah she's here but uh can she call you back? OK thanks. Call Joanna. Hi.,SAD
Did she leave a number?,CALM
Did you see me write one down?,CALM
I don't have her number butt-munch.,ENERGETIC
Well she'll call back don't be such a baby.,ENERGETIC
I'm not a baby you're the baby.,ENERGETIC
Look you wanna get off my back?,ENERGETIC
You wanna get out of my face?,ENERGETIC
Give me that.,ENERGETIC
OK.,HAPPY
Hey.,CALM
So uhh how's the palace?,CALM
Nice to meet ya.,CALM
At the uh supermarket in the uh ethnic food section. I helped him pick out a chorizo.,CALM
Wow.,ENERGETIC
Well you know we got to talking and uh he said he needed a place and I had a spare room.,SAD
Oh now it's a spare room?,ENERGETIC
Well yeah in that it's not being used and I... have it to spare.,SAD
Well I uh got what I came for. I'll uh I'll see you guys.,CALM
Hey Jo. When'd you start usin' mousse in your hair?,CALM
Is this guy great or what?,HAPPY
Yeah yeah he is.,ENERGETIC
I can't believe he has a new roommate. Who is this guy?,ENERGETIC
Uh Eddie something. He just met him.,CALM
It'll never last he's just a rebound roommate.,SAD
Hey.,CALM
Hey.,CALM
Now OK I haven't seen it yet so if you don't like it well so what none of you ever made a video. OK.,HAPPY
Oh my God.,HAPPY
I know.,HAPPY
Pretty uhm different huh?,HAPPY
Oh I am sorry but I am incredibly talented.,SAD
Hi Joey what's goin' on man?,CALM
Eddie.,CALM
Morning.,CALM
Morning. I just uh came by to pick up my mail. Where's the mail?,CALM
Oh it's uh over there on the table.,CALM
No Eddie likes to keep it over there.,CALM
Alright here you go my friend. Eggs a-la Eddie huh?,CALM
Oh ooh.,HAPPY
Huh.,CALM
What?,CALM
No I just uh thought you liked your eggs with the bread with the hole in the middle a-la me.,CALM
Well I do but uh Eddie makes them this way and well they're pretty darn good.,SAD
Well you guys I'm outta here. See ya pals.,CALM
See ya.,CALM
So how you two gettin' along?,CALM
Oh I couldn't be happier.,HAPPY
There's another carton right over there.,HAPPY
Hey this isn't about juice anymore alright man.,ENERGETIC
Alright so what's it about?,CALM
Eggs. Who's eggs do you like better his or mine huh?,ENERGETIC
Well I like both eggs equally.,CALM
Oh come on. Nobody likes two different kinds of eggs equally. You like one better than the other and I wanna know which.,ENERGETIC
Well what's the difference? Your eggs aren't here anymore are they? You took your eggs and you left. You really expect me to never find new eggs?,CALM
Hey.,CALM
Hey.,CALM
Listen. You are not going to believe this but that is not me singing on the video.,CALM
No.,HAPPY
Yes.,CALM
Well how did you find out?,CALM
So what're you gonna do?,CALM
Well I can't work with people who would do this.,CALM
Sure.,CALM
I mean this poor woman.,SAD
What woman?,CALM
The voice woman. Ya know I mean she has a great voice but she doesn't have a video.,CALM
OK Phoebs. But what about you?,CALM
Hey Eddie you uh wanna play some foosball?,CALM
No thanks man I'm not uh I'm not really into sports.,SAD
Yeah o- OK alright. Doesn't matter time for Baywatch.,CALM
Y- y- you like that show?,CALM
You don't like that show?,CALM
Well that's the brilliance of it. The pretty people... and the running.,HAPPY
I tell ya I- I'm gonna go read in my room for a little while.,CALM
Oh o- OK man.,CALM
Smelly cat smell-ly cat what are they feeding you? Everybody.,HAPPY
Smelly cat smell-ly cat it's not your fault.,HAPPY
Monica.,CALM
They won't take you to the vet.,HAPPY
Chandler.,CALM
You're obviously not their favorite pet.,HAPPY
Joey.,CALM
It may not be a bed of roses.,HAPPY
Rachel.,CALM
And you're no friend to those with noses.,HAPPY
Oh Drake.,CALM
I'm sorry I'm late what happened?,SAD
We we just wanna see the end.,CALM
I want you Drake.,ENERGETIC
What?,CALM
So what happens next?,CALM
God that is good TV.,HAPPY
Phoebs play with meeee.,HAPPY
Why don't you play with your roommate?,CALM
We don't need to remedy that.,SAD
Oh yeah it'll be fun.,HAPPY
What was that?,SAD
Yeah alright that sounds alright.,CALM
That was so lame.,SAD
I know yeah. Ok talk to him.,ENERGETIC
Well it's not Sean Penn.,HAPPY
Phoebe's got another job right?,CALM
Great set tonight Phoebs.,CALM
I know.,CALM
Well we should probably get going.,CALM
I don't know I don't have my jammies.,CALM
Well maybe you don't need them.,CALM
My baby sister ladies and gentlemen.,CALM
Shut up I'm happy.,HAPPY
Oh thank you Phoebs. That's very sweet.,HAPPY
Ok.,CALM
Not a lot Phoebe's kidding Phoebe's crazy.,SAD
Phoebe's dead.,SAD
Hi.,CALM
Hi.,CALM
I'm looking for Eddie Minowick.,CALM
Thanks.,CALM
Oh oh c'mon in.,CALM
I'm Tilly.,CALM
Oh.,CALM
He's kind of intense huh?,ENERGETIC
A little what?,CALM
Hello Tilly.,CALM
Well ok then. I'm gonna go. Bye.,CALM
Bye-bye.,CALM
Bye.,CALM
So we gettin' a fish?,CALM
You had sex with her didn't you?,ENERGETIC
Ooh I look good.,HAPPY
Uhh I don't know I just bring the scripts.,CALM
Right. Could you sign this?,CALM
No. No way I'm not signing that.,ENERGETIC
How can they do this to me?,ENERGETIC
Er uh I'm just gonna go. Sorry.,SAD
G'night.,CALM
Night Richard. Good luck Mon.,CALM
Two.,CALM
Uhhhooo.,SAD
Well there's you.,SAD
Oh yes the weenie from Torrini.,ENERGETIC
Really?,CALM
Where's Buddy?,CALM
Buddy?,SAD
My fish Buddy.,CALM
C'mon.,CALM
Hey Eddie. Daahh!! What're you doin' here?,SAD
Nothin' roomie just watchin' you sleep.,CALM
Why?,SAD
Makes me feel um peaceful heh-heh please.,CALM
I can't sleep now.,CALM
You want me to sing?,CALM
Hannibal Lecter...better roommate than you.,ENERGETIC
I didn't realize that.,CALM
Yeah.,CALM
GET OUT NOW!!,ENERGETIC
Ok you really want me out?,SAD
Yes please.,ENERGETIC
I want you out.,CALM
No no no I wanna hear it from your lips.,CALM
Where did you hear it from before?,CALM
I heard that.,CALM
Don't worry about it already. Things happen.,CALM
So you're not mad at me for getting fired and everything?,SAD
Joey look at me look at me. Do I have lipstick on my teeth?,CALM
No can we get back to me?,SAD
Look honey people get fired left and right in this business. I already got you an audition for Another World.,ENERGETIC
Alright. Cab driver number two?,CALM
You're welcome.,ENERGETIC
But I was Dr. Drake Remoray. How can I go from bein' a neurosurgeon to drivin' a cab?,SAD
Things change roll with em.,CALM
But this is a two line part it's like takin' a step backwards. I'm not gonna do this.,CALM
Joey I'm gonna tell you the same thing I told Al Minser and his pyramid of dogs. Take any job you can get and don't make on the floor.,ENERGETIC
I'm sorry. See ya.,CALM
Oh God oh God I mean it's just so.,HAPPY
Isn't it.,CALM
Uhh I mean this is like reading about my own life. I mean this book could have been called 'Be Your Own Windkeeper Rachel'.,ENERGETIC
Hey you guys.,CALM
Hey.,CALM
Uh sweetie we've gotta go.,SAD
NO!,ENERGETIC
No?,SAD
No why do we always have to do everything according to your time table?,ENERGETIC
Actually it's the movie theatre that has the time schedule. So you don't miss the beginning.,CALM
No see this isn't about the movie theatre this is about you stealing my wind.,ENERGETIC
You go girl. I can't pull that off can I?,ENERGETIC
Excuse me your your your wind?,ENERGETIC
Yes my wind. How do you expect me to grow if you won't let me blow?,ENERGETIC
Ok I just I just really need to be with myself right now. I'm sorry.,CALM
Um-um um-um.,CALM
You're right I don't have to apologize. Sorry. Damnit!,ENERGETIC
Hey pal.,CALM
Ahhhh-gaaaahhh. Eddie what're you still doin' here?,ENERGETIC
Ah just some basic dehydrating of a few fruits and vegetables. MAN ALIVE this thing's fantastic!,HAPPY
Look Eddie aren't you forgetting anything?,CALM
Maybe 'cause the last one was made by Pepperidge Farm. Look Eddie isn't there something else you're supposed to be doing right now?,ENERGETIC
Well not unless it's got something to do with dehydrating my man because right now I'm a dehydrating maniac!,HAPPY
Ah-ah-ah you know what that is?,HAPPY
Your last roommate's kidney?,CALM
That's a tomato. This one definitely goes in the display.,CALM
Hey Gunther let me get a lemonade to go.,CALM
Lemonade? You ok man?,SAD
Oh that's too bad. How'd they do it?,CALM
I fell down an elevator shaft.,SAD
That sucks. I was buried in an avalanche.,SAD
What?,SAD
I used to be Bryce on All My Children.,CALM
Daaahhhh!,HAPPY
Aaahhhhhhh! Aaahhhh!,SAD
Why must everybody watch me sleep? There'll be no more watching me sleep no more watching.,ENERGETIC
I wa-,CALM
Uuuh.,CALM
Get out. Get out get out get out get out get out get out.,ENERGETIC
What?,SAD
You you want you want me to move out?,SAD
Uh-huh.,ENERGETIC
This is not out of the blue this is smack dab in the middle of the blue.,ENERGETIC
You want some help.,ENERGETIC
No help required Chico.,SAD
All the way to the airport huh? You know that's over 30 miles that's gonna cost you about so bucks.,CALM
Excuse me that's 50 bucks.,ENERGETIC
What?,CALM
Five oh dollars.,ENERGETIC
That's great.,ENERGETIC
Ok listen thanks for coming in.,ENERGETIC
Ok question number 28 have you ever allowed a lighning bearer to take your wind? I would have to say no.,CALM
And I would have to say pah-huh.,CALM
What?,SAD
Do you not remember the puppet guy?,SAD
Yeah you like totally let him wash his feet in the pool of your inner power.,HAPPY
And his puppet too.,HAPPY
Yeah ok well at least I didn't let some guy into the forest of my righteous truth on the first date.,ENERGETIC
Who?,SAD
Paul.,CALM
Oh.,CALM
Woah woah woah let's go back to 29.,CALM
Not uh not to my recollection.,CALM
Only 'cause you took up half the circle.,ENERGETIC
Listen to you two. It's so sad. Looks like I'm gonna be going to the goddess meetings alone.,SAD
Well not when they find out you slept with Jason Hurley an hour after he broke up with Monica.,CALM
One hour? You are such a leaf blower.,ENERGETIC
May I help you?,CALM
Why doesn't my key work and what's all my stuff doin' downstairs?,ENERGETIC
Well I'm I'm sorry... Ahhh. Have we met?,SAD
It's Eddie you freak your roommate.,ENERGETIC
I I'm sorry I uh I already have a roommate.,SAD
Hello.,CALM
Yeah he's lived here for years I don't I don't know what you're talking about man.,SAD
No he he moved out and I moved in.,ENERGETIC
Well I I think we'd remember something like that.,CALM
I know I would.,CALM
Hey no problem.,CALM
Welcome home man.,HAPPY
A little foos?,CALM
Absolutely.,HAPPY
What happened to the foosball?,CALM
Ah that's a cantelope.,CALM
Hey look are we gonna have to bring this out every time Ross comes over?,ENERGETIC
He paid a lot of money for it.,ENERGETIC
Well I had a whole ceramic zoo thing goin' over there but now without the other ones it just looks tacky.,SAD
Hey Monica why are we watchin' the business channel?,SAD
Ok honey you really need a job.,CALM
Mon speaking of which dad says he knows someone you can call for an interview.,CALM
Really.,SAD
Ok right there. That that's the third sign today. Right there.,SAD
On behalf of everyone I'd just like to say behuh.,CALM
No 'cause you just said dad and everywhere I go today I keep getting signs telling me to go see my father. Like when I was walking over here and I passed a buffet...which is my father's last name.,ENERGETIC
Ahh.,CALM
And they were serving franks which is his first name minus the s at the end. And there was a rotisserie with spinning chicken.,SAD
His indian name?,SAD
No because I chickened out the last time when I tried to meet him. So I mean coincidences? I don't think so.,ENERGETIC
Freakish.,CALM
Wow.,HAPPY
Freaky.,SAD
Weird weird.,SAD
Ok so uh who wants the last hamburger?,HAPPY
Oh alright that's it now I have to go see him.,SAD
Why?,SAD
Hamburger. McDonald's. Old MacDonald had a farm my dad is a pharmacist.,CALM
Man I am so beat.,CALM
Oh yeah.,CALM
Hey you just wanna forget about raquetball and hang out here?,CALM
Yeah alright.,CALM
Hey you're in our seats.,ENERGETIC
Oh sorry we didn't know.,SAD
Hey we were sitting there.,ENERGETIC
Ok there is one more way to say it who knows it?,ENERGETIC
Is that supposed to be funny?,ENERGETIC
No actually I was just going for colorful.,SAD
What's with this guy?,ENERGETIC
What's with you?,ENERGETIC
Uh nothing nothing's with him. Enjoy your coffee.,SAD
What just happened?,ENERGETIC
I just took your hat. See I can be funny too. My my joke is that I I took your hat.,ENERGETIC
That that is funny. Can I have it back?,SAD
No.,ENERGETIC
No?,ENERGETIC
No.,ENERGETIC
Ok ok you know what? I think you're very funny. Kudos on that hat joke. But come on guy just just give him back the hat.,ENERGETIC
Why should we?,ENERGETIC
Because it's a special hat. See he bought it 'cause he was feeling really down one day so he got the hat to cheer himself up ya know. Now Chandler...,CALM
Stop talking stop talking now. Let me just get this straight. You're actually stealing my hat?,ENERGETIC
You got a problem with that?,ENERGETIC
No just wanna make sure we're on the same page.,SAD
See didn't I tell ya these pillows would be a good idea?,ENERGETIC
Oh God here we go. For the first time in my life I'm gonna say 'Hi birthfather'.,SAD
We love you we're here for you.,CALM
Yeah good luck good luck.,CALM
Thanks.,ENERGETIC
Hey Rach you uh you want some sandwich?,CALM
Ohh what is in that?,CALM
Olive loaf and ham spread no mayo.,CALM
No no 'cause mayo that would make it gross.,CALM
Hey hey no oh oh.,SAD
Run Phoebe run.,SAD
Are you kidding me?,ENERGETIC
Well why don't you just reach out and take his trampoline.,CALM
Ok here I know what we can do.,CALM
Hey hey hey no.,ENERGETIC
Well if he's not gonna eat it I will.,CALM
Are you crazy?,SAD
Phoebs he's just a little dog. Ahhh.,SAD
Hey Phoeb's I think you're good to go.,CALM
Yeah I don't know.,SAD
What's the matter?,SAD
Yeah Phoebe I completely understand.,CALM
Yeah whatever you need. Hey you wanna go home?,CALM
Ok thanks. Sorry again,SAD
What was that?,SAD
Uhh I'm guessing the threshold's clear now.,SAD
Your cappucino sir.,CALM
Thank you.,CALM
Absolutely.,HAPPY
How come it's not mixing with the water?,SAD
Ok.,CALM
No.,ENERGETIC
No?,SAD
Alright hang on a second there Custer.,CALM
Yeah sure.,CALM
By someone besides Monica?,SAD
Well couldn't we just lose our virginities again? Ya know because I think actually mine's growing back.,HAPPY
I need to borrow a hundred bucks.,SAD
What?,SAD
For what?,SAD
I've gotta get back in the game.,SAD
Oh no.,SAD
Hey I've come to terms with it you have to too.,CALM
Ok. Look uhh Mon I'm I'm really sorry.,SAD
Yeah yeah yeah where are we on the hundred bucks?,CALM
I I don't have it.,SAD
Nobody does honey.,SAD
God that was that was amazing that was incredible. You guys you guys kicked butt.,HAPPY
Us what about you guys? Man you really bing gave it to old Mr. Clean back there. He was a big guy.,HAPPY
Yeah he was wasn't he.,CALM
Yeah I wouldn't know having missed everything.,SAD
Don't do that to yourself. Any one of us could have tripped over that little girls jump-rope.,SAD
So listen guys are we uh are we ok here?,SAD
We're ok.,CALM
Alright.,CALM
Ok so can I have my hat back?,HAPPY
No.,ENERGETIC
Huh.,CALM
Look at her.,CALM
Hi Monica.,CALM
He-he-he how's it goin'?,HAPPY
Hey nice boobs.,HAPPY
Guys guys check this out.,HAPPY
Excellent.,CALM
Ohhh.,ENERGETIC
What?,CALM
Question. Why do we always have to have parties where you poach things?,CALM
You wanna be in charge of the food committee?,SAD
Question two. Why do we always have to have parties with committees?,CALM
Really. Why can't we just get some pizzas and get some beers and have fun?,CALM
Yeah.,CALM
Yeah I agree. Ya know I think fancy parties are only fun if you're fancy on the inside and I'm just not sure we are.,CALM
Alright. If you guys don't want it to be special fine. You can throw any kind of party you want.,ENERGETIC
Joey they're not real. I start miles beneath the surface of these things ok they're fake. See honk honk.,ENERGETIC
Wow it's it's like porno for clowns.,HAPPY
I talked to Rachel's sisters neither of them can come.,CALM
Ok um so I still have to invite Dillon and Emma and Shannon Cooper.,CALM
Woah woah woah uh no Shannon Cooper.,ENERGETIC
Why not her?,CALM
Cause she uh she steals stuff.,CALM
Or maybe she doesn't steal stuff and Joey just slept with her and never called her back.,ENERGETIC
Joey that is horriable.,ENERGETIC
Hey I liked her alright. Maybe maybe too much. I don't know I guess I just got scared.,SAD
I'm sorry I didn't know.,SAD
I didn't think anyone'd buy that ok.,CALM
Hi honey how did it go?,HAPPY
Agh it was the graduation from hell.,ENERGETIC
So what happened?,CALM
Ok so I guess we don't invite her parents.,CALM
Well how bout just her mom?,CALM
Why her mom?,SAD
Cause I already invited her.,CALM
Ooh ooh did you ask Stacy Roth?,CALM
Oh no can't invite her. She also steals.,SAD
Ok ok you can be shirts and I'll be skins. I'll be skins. Hey how you holdin' up there tiger? Oh sorry when my parents were getting divorced I got a lot of tigers. Got a lot of champs chiefs sports I even got a governor.,HAPPY
This is it isn't it? I mean this is what my life is gonna be like. My mom there my dad there. Thanksgiving Christmas. She gets the house he's in some condo my sister's gonna decorate with wicker. Oh Chandler how did you get through this?,SAD
Well I relied on a carefully regimented program of denial and and wetting the bed.,CALM
Ya know I just so weird. I mean I was in there just listening to them bitch about each other and all I kept thinking about was the fourth of July.,SAD
Becasue it reminded you of the way our forefathers used to bitch at each other?,CALM
I I know.,CALM
Ok thanks for coming I hope you guys had fun.,CALM
Alright Monica dear I'm gonna hit the road. Now I've left my 10 verbs on the table. And you be sure and send me that finished poem.,CALM
Ok will do. So glad you came.,HAPPY
I think I saw Rachel out in the hall.,CALM
Ok let me go check. Your mom want's to say goodbye.,CALM
Oh ok.,CALM
Happy birthday sweetie.,HAPPY
Ok.,ENERGETIC
Ahh you drive safe.,CALM
Ross what're you doing.,CALM
I'm getting ready for the water skiing. How are you doing?,CALM
Well uh Dr. Greene where are you going?,SAD
To get my coat.,CALM
No no no.,SAD
Alright alright I can get my own coat.,ENERGETIC
Sorry we're on a major flan high.,HAPPY
I have to be heading to my chateau thank you.,ENERGETIC
Oh all right then I guess we're going back into the hallway.,SAD
Thanks for coming Mrs. Greene. Well ok you take care.,CALM
Oh you kids Well this is the best party I've been to in years.,HAPPY
Thank you.,CALM
Ok everybody it's time for flan.,ENERGETIC
Yup get ready for the gelatenous fun.,HAPPY
Kinda looks like that stuff you get when you get a bad infection.,CALM
Ok that's enough.,CALM
Ok Rachel make a special flan wish.,CALM
Ok I've got one. Wow those things almost never come true.,HAPPY
Hey Joey how'd the audition go?,CALM
Incredible! I met the director this time and you'll never believe who it was.,HAPPY
Who?,CALM
All right. I'll give you one hint. Warren Beatty.,CALM
Wow!,HAPPY
Yeah there's just one thing that might be kind've a problem. See I uh had to kiss this guy.,SAD
Cause he was just so darn cute.,HAPPY
No as part of the audition. See I'm up for this part of this guy who the main guy kisses.,CALM
Well hey. You're an actor I say you just suck it up and do it. Or you just do it.,CALM
I did do it I'm a professional.,CALM
Then what's the problem?,ENERGETIC
See after the scene Mr. Beatty comes up to me and says 'good actor bad kisser'. Can you believe that me not a good kisser that's like like Mother Theresa not a good mother.,ENERGETIC
Well come on who cares what that guy thinks. What does Warren Beatty know about kissing Ooh.,CALM
Hey what did your agent say?,CALM
Yep this kiss thing is defiantly a problem Mr. Beatty wants to see it again on Monday. Man I gotta figure out what I'm doing wrong. Oh okay one of you girls come over here and kiss me.,SAD
What forget it!,ENERGETIC
Yeah right.,ENERGETIC
Come on I need your help here.,SAD
All right. I'll do it I kissed him before I can do it again.,HAPPY
You see this this is a friend.,CALM
Uh-huh let's go. Oh wait I have gum. Okay. Good very good firm but tender. I'd recommend you to a friend.,HAPPY
Then I don't know what it is. What's the problem?,SAD
Yeah that makes sense.,HAPPY
Over my dead body!,ENERGETIC
And I'll be using his dead body as a shield.,CALM
Where's Benny? There he is! Where's Benny there he is.,HAPPY
Awww! You know that's probably why babies learn to talk so they can tell grown ups to cut it out.,HAPPY
Okay.,CALM
Did you ever uh like think about the future?,SAD
Sure I do.,CALM
Yeah am I in it?,SAD
Honey you are in it.,CALM
Oh God you are about to get sooo lucky.,HAPPY
Oh yeah!,HAPPY
Keep talkin'.,HAPPY
Well uh sometimes I think about selling my practice we could move to France make French toast.,HAPPY
Okay so uh we're in France we're making the toast. Do you see a little bassinet in the corner?,SAD
Like a hound?,HAPPY
Not a basset a bassinet.,ENERGETIC
You really need the bassinet?,SAD
Well I just think the baby would keep falling off the dog. Do you uh do you  do you not see kids in our future.,SAD
Uh-huh.,SAD
Look I want you now.,CALM
That's Great. You know we don't need to talk about this now. Really I mean this is is so way way way in the future I'm talkin' hovercrafts and apes taking over the planet.,SAD
Hey there.,CALM
Hi.,CALM
Are you all right?,CALM
God I know you're right.,SAD
All rightie everybody look at me. Good. All right its time. Bridesmaids and ushers let's see two lines thank you.,ENERGETIC
Okay I'll see you after the thing.,CALM
Okay good luck,HAPPY
Thank you Okay Okay.,CALM
Angela? Joey Tribiani. Listen what are ya doing tonight. I know your seeing that guy I was thinking maybe you could bring him.....Hello? Hello?,ENERGETIC
Aren't you gonna answer her that's like the tenth bing-bong message she sent. She wants to know what's wrong?,ENERGETIC
What's wrong? What's wrong? You're married that's what's wrong.,ENERGETIC
Oh my.,ENERGETIC
What?,ENERGETIC
She wants to meet you in person.,CALM
Hey look Phoebe I wanted to meet her in person too okay but she's married she has a husband.,SAD
Okay I'll do it!,ENERGETIC
Okay one more please. Come on I'm gonna get it in this time I will.,HAPPY
Okay last chance. Again I'm sorry.,CALM
Yo! Can I have your attention please Best Man making a toast here. Thank you. I remember when Barry got home from his first date with Rachel...,HAPPY
What?!,SAD
What you hired the same band I can't use the same speech. Thank you thank you very much. Anyway I wish you both a wonderful life together. And Rachel...,CALM
What.,CALM
Most of you don't know me I'm Rachel's boyfriend.,CALM
Oh dear God.,SAD
Ross uh and uh I'd just like to say that it did take a lot of courage for Rachel to come here tonight. And uh for the record she did not run out on Barry because she had syphilis. What are you doing I'm serious. Uh the reason she walked out on on Barry is simply that she didn't love him which incidentally worked out pretty well for me Cheers.,HAPPY
She you in the parking lot.,ENERGETIC
No Rach!,SAD
And once again she is out of here. Okay who had 9:45? Um?,CALM
Marenge,CALM
...marenge thank you honey and do the cha-cha. And while she like to be a star Tony always tended bar. At the wait wait everybody..,HAPPY
Everybody!,HAPPY
Okay I'll do it.,CALM
You'll do what?,SAD
If kids is what I takes to be with you then kids it is.,ENERGETIC
Oh my God!,HAPPY
Really?,HAPPY
Yeah if I have to. Monica I don't wanna lose you so if I have to do it all over again then I will.,CALM
You're the most wonderful man. And if you hadn't of said 'if I have to' like seventeen times then I'd be saying 'okay let's do it.',ENERGETIC
But you're not.,SAD
Oh my God I can't believe what I'm getting ready to say. I wanna have a baby but I don't wanna have one with someone who doesn't really wanna have one.,ENERGETIC
God. I love you.,CALM
I know you do. Me too. So what now?,CALM
I guess we just keep dancing.,CALM
Where is she Where is she? Oh hey I have a question where is she?,SAD
Chandler relax Chandler she'll be here.,CALM
Ooh oh oh that's her.,HAPPY
Yeah 'cause life's just that kind.,CALM
Oh my God!,HAPPY
OH.....MY.....GAWD!!,HAPPY
OH.....MY.....GOD!!,HAPPY
All right they got water orange juice and what looks like cider.,CALM
Taste it.,HAPPY
Yep it's fat. I drank fat!,ENERGETIC
Yeah I know I did that two minutes ago.,HAPPY
Hey!,HAPPY
Hey mister tux!,HAPPY
Why aren't you guys dressed?,SAD
We have a half hour.,ENERGETIC
Relax Ross we'll be ready. It only takes us two minutes to get dressed.,ENERGETIC
Okay.,CALM
Hey-hey! Oh look at you all sexy.,HAPPY
Really.,HAPPY
Ooooh! Wow!! Oh hi.,HAPPY
Hi.,CALM
How come you didn't come over earlier?,CALM
Cause I'm a stupid stupid man.,ENERGETIC
Hey Ross want some cider?,ENERGETIC
No. So um let's see your pretty close huh. Make-up's on hair's done.,CALM
Yeah I just have to get dressed.,CALM
