Utterance,Emotion
Noo!! It's driving me crazy. I mean every other way he's like the perfect guy he has everything. Plus! He actually has everything.,ENERGETIC
Life-sized Imperial Storm Troopers from Sharper Image?,CALM
Two.,CALM
Wow!! Can Joey and I put them on and fight?,HAPPY
I guess he musta gotten the part in that play.,HAPPY
Oh.,CALM
Joe. How's it going?,CALM
Good. Hey.,CALM
Hi.,CALM
Oh so you're playing Adrienne huh?,SAD
Yes. Are you one of the retarded cousins?,CALM
Oh no. Ah I playing your husband Victor. I'm Joey Tribianni.,CALM
Hi nice to meet you. Kate Miller.,CALM
So the ah play's pretty great huh?,SAD
Oh yeah. I love Jennifer Van Murray's work. She's so brilliantly incisive when it comes to deconstructing the psyche of the American middle class.,CALM
Oh forget about it. She rocks!,HAPPY
Where do I know you from?,CALM
Dr. Drake Remoray. Days of Our Lives. Voted most datable neurosurgeon by Teen Beat.,CALM
No that's not it. So you're a soap actor? Well this must be pretty exciting for you to be in a real play hmm?,CALM
Hey I've done plays before. I'm a serious actor.,ENERGETIC
See I actually can pour milk but I got you believing that I couldn't. Now see that's acting.,CALM
Right at the end you choked on a cookie.,HAPPY
Yeah that was real.,CALM
Wow! I cannot believe Mark asked you out.,HAPPY
I know.,HAPPY
What so what are you gonna tell him?,CALM
Well I told him I would think about it but I'm gonna tell him no.,SAD
Huh.,CALM
I mean I think I'd say no to anybody right now. Oh but it was so strange. I mean I'm standing there with this charming cute guy who's asking me to go out with him which I'm allowed to do and I felt guilty. Y'know like I'd be cheating on Ross or something.,SAD
Wow. So okay maybe that means that you're not over Ross yet and you have issues with your father.,ENERGETIC
I don't have any issues with my Father.,ENERGETIC
Okay so it's probably just the Ross thing then.,CALM
I hate this woman!! I hate her! She told everyone in the company about that info-mercial and now they all keep asking me to open their drinks. Okay and whenever I can't do it they're all like-like laughing at me.,ENERGETIC
Hello.,HAPPY
Hey!,HAPPY
So Rachel called. Wants to see me. Going over in a minute.,CALM
Wow what-what do you think she wants?,CALM
Well maybe the crazy fog has lifted and she realises that life without me.... a-sucks.,ENERGETIC
It's possible. You are very loveable I'd miss you if I broke up with you. I was just trying to be supportive.,CALM
Then be supportive like a guy.,CALM
If I broke up with you I'd miss you.,HAPPY
So you're like a zillionaire?,HAPPY
And you're our age. You're our age.,SAD
Y'know what you should like you should buy a state and then just name it after yourself.,HAPPY
What like Pete Dakota?,HAPPY
Yeah or or or Mississ-Pete.,HAPPY
Oh oh I got it! Pete-Chicago.,HAPPY
That's not a state Joe.,ENERGETIC
Oh and Mississ-Pete is?,ENERGETIC
I got to go so ah I'll see you guys later.,CALM
Okay.,CALM
You're our age!,ENERGETIC
So ah we on for tomorrow?,HAPPY
Yeah kinda.,CALM
Happy?! Is that what I'm supposed to be Vic? Happy?,HAPPY
Well why don't you tell me what you're supposed to be! Huh? Because I sure as hell can't figure it out! I talk to you and nothin'. You look at me and it's nothin'. Nothing.,CALM
Tasty! I'm really starting to feel like you guys have a history it's-it's nice.,ENERGETIC
I have a question about this scene.,CALM
Yes?,CALM
Well I don't understand why Adrienne's attracted to Victor.,SAD
Peel the onion. First of all he's good looking.,ENERGETIC
Yeah.,CALM
I think my character's gonna need a little bit more of reason than that.,CALM
Oh hey how about this one. Ah it's says so in the script! Y'know ah I-I don't know why my character likes you either I mean it says in the script here that you're a bitch.,ENERGETIC
It doesn't say that in the script.,SAD
It does in mine!,CALM
Ross! You gotta stop! Okay?! You can't just stare through the peep hole for three hours! You're gonna get peep eye!,ENERGETIC
I knew it! I knew it! I always knew she liked him! Y'know she'd say no but here we are! Right? We just broke up first thing she does!,ENERGETIC
You didn't just break up.,ENERGETIC
Hey it's been like three weeks!,ENERGETIC
You slept with somebody three hours after you thought you broke up. I mean bullets have left guns slower!,ENERGETIC
Okay.,CALM
She's going in. Wait! He's going in! He's going in!! The door's closed! I I can't see anything but the door closed!!,SAD
And the inventor of the door rests happily in his grave.,CALM
Okay I have to do something. I mean I have I have to stop it!,SAD
Stop what?!,ENERGETIC
No!! You can't!!,ENERGETIC
Look they must be stopped!,ENERGETIC
I am your friend and I am not gonna let you do this!! You are surprisingly strong!,ENERGETIC
I need juice! People need juice!!,SAD
Look man!,ENERGETIC
People need juice!,ENERGETIC
Listen to me!!,ENERGETIC
Juice I need...,CALM
Yeah okay.,SAD
Okay.,ENERGETIC
It's just I miss her so much.,SAD
I know.,CALM
Why do all you're coffee mugs have numbers on the bottom?,SAD
Oh. That's so Monica can keep track. That way if one on them is missing she can be like 'Where's number 27?!',CALM
Y'know what?,CALM
No. And I don't think I'm gonna want to.,SAD
I can't do this.,CALM
Yep. Yep that's what I didn't want to know.,CALM
Well oh Mark I'm doing this for the wrong reasons y'know? I'm just doing it to get back at Ross. I'm sorry it's not very fair to you.,SAD
Oh God. I'm sorry about this.,SAD
That's okay.,CALM
You sure?,CALM
Yeah. I can just go home and get back at him by myself.,CALM
Hey can I ask you something?,CALM
Sure.,CALM
Where are we?,SAD
Well with all these doctors and nurses I'm gonna say midget rodeo.,CALM
Just tell me the truth.,CALM
Oh yeah. Wasn't that like a year ago?,CALM
Oh yeah. I know that.,CALM
I so wanna be attracted to you.,SAD
But you're not. Okay good.,SAD
I'm sorry.,CALM
Y'know what don't be. This is not don't be 'cause it's not so bad.,SAD
It's not?,SAD
I know I'm no John Bon Jovi or someone who find attractive I'm just I think y'know that you might end up feeling differently.,CALM
Well um look I-I don't want this to come our wrong but ah you seem awfully confident for a guy I just told I wasn't attracted too.,CALM
Yeah stupidly charming isn't' it? Well listen let's you wanna get something to eat? 'Cause this place is kinda depressing.,CALM
And the man who made all this possible... Mr. Peter Becker.,CALM
One second.,CALM
I don't think this town is big enough for both of us to relax in. Draw!!,HAPPY
I wasn't doing anything. Uh-oh what did she do now?,ENERGETIC
Just because she went to Yale drama she thinks she's like the greatest actress since since sliced bread!,ENERGETIC
Ah Sliced Bread a wonderful Lady MacBeth.,CALM
God I just I hate her! I hate her!! With her 'Oh I'm so talented.' and 'Oh I'm so pretty' and 'Ooh I smell so good.',SAD
I think somebody has a crush on somebody.,HAPPY
Hey Chandler can we please stay focused on my problem here?! Y'know?,ENERGETIC
I'm talking about you. You big big freak.,CALM
Oh. Ohh. Ohh you're out of your mind.,SAD
Oh yeah?! Then how come I keep thinking about her in all these sexual scenarios and stuff huh?!,ENERGETIC
Happy?! Is that what I'm supposed to be Vic? Happy?,ENERGETIC
Well why don't you tell me what you're supposed to be! Huh? Because I sure as hell can't figure it out! I talk to you and it's nothin'. You look at me and nothin'. Nothing.,ENERGETIC
You guys make me fly! High! Okay we're gonna pick it up here tomorrow.,ENERGETIC
Well that was ah...,HAPPY
Better?,HAPPY
Yeah! Yeah it was definitely an improvement. G'night.,HAPPY
Ah Kate?,CALM
Yeah?,CALM
You ah you forgot your shoes.,CALM
I'm probably gonna need those. Huh?,HAPPY
Hey listen you ah....,CALM
Hmm?,CALM
...feel like getting a cup of coffee?,HAPPY
Umm.,CALM
Kate?,CALM
Yep.,CALM
You ready to go?,CALM
Yeah.,CALM
Very nice. Very nice.,HAPPY
Yeah yeah sure goodnight.,SAD
Hey! Why isn't it Spiderman? Y'know like Goldman Silverman...,HAPPY
Cause it's-it's not his last name.,CALM
It isn't?,SAD
No it's not like like Phil Spiderman. He's a spider man. Y'know like ah like Goldman is a last name but there's no Gold Man.,HAPPY
Oh okay. There should be Gold Man!,HAPPY
Hey!,HAPPY
Hey Rach how was work?,HAPPY
Oh great. Although I did sit down where there wasn't a chair.,CALM
By the way Ross dropped by a box of your stuff.,CALM
Oh well I guess I had that one coming. I'm just gonna throw it out it's probably just a bunch of shampoo and...,SAD
Something wrong?,SAD
No. Nothing.,SAD
So ahh what kind of powers would Gold Man have?,HAPPY
Okay well he would turn things to gold.,CALM
What about things that are already gold?,CALM
Ahh his work is done.,CALM
Okay let's play my game now.,HAPPY
Okay. All right you yellow-bellied-lilly-livered-DRAW!!,HAPPY
Here you go. You can wear this.,CALM
Thanks!,HAPPY
Uh-huh.,CALM
Okay. Ooh I'm setting the phone down. But I'm still here! Just don't go anywhere I'm still here. Don't-don't switch or anything 'cause I'm I'm right here. Just one sec. One sec! One second!! Wait! One second! Just...,SAD
Phoebe?,CALM
What?! Monica I'm scared!!,SAD
All right. Honey that's-that's a sleeve. Okay?,CALM
Yeah.,CALM
And! We also have speaker phone.,CALM
Please stay on the line. Your call is important to us.,CALM
Okay wait you gotta hang up 'cause we're gonna be late.,CALM
Thank you for your patience you're the next caller.,CALM
Yes!! Yes!! I'm the next caller! You were gonna have me hang up.,HAPPY
Hey! Can you take a duck and a chick to the theatre?,HAPPY
Of course not.,ENERGETIC
No.,CALM
Okay. I just wanted them to hear it from somebody else.,CALM
Hey!,HAPPY
Hey!,HAPPY
Oh is the play over?,SAD
Yeah. Where were you?,ENERGETIC
Thank you for your patience you're the next caller.,CALM
You were the next caller five hours ago. You must be going crazy.,CALM
Nah. I kept myself busy.,CALM
Oh okay yeah. I put your stuff in her room and her stuff in your room.,CALM
Hey! Are you okay?,CALM
Fabulous.,SAD
Listen drama critics they're nothing but but people who couldn't make it as actors. You know what you should do?,CALM
Become a drama critic!,CALM
I am hurt! A plague on both your houses!,SAD
By the way he dumped me tonight after he read my review.,SAD
Oh classy.,ENERGETIC
Yep! I sure know how to pick 'em huh? Y'know I gave up a part on a soap for this!,ENERGETIC
Wow! Yeah I ah I gave up a job too.,HAPPY
Really. What?,SAD
Uh de-clawing cats. Hey tell ya what. Let me walk you home. We'll stop by every news stand and burn every copy of their Times and the Post.,ENERGETIC
Why the Post?,SAD
Oh you didn't see the Post?,SAD
No. You?,SAD
No. Why?,ENERGETIC
So you really think those newspapers are just jealous of me?,SAD
Oh absolutely! You're talented and you're good looking.,HAPPY
Oh you're sweet and cute.,HAPPY
I know! That's why they trashed me!,SAD
Whoa. Wait a minute wait a minute.,HAPPY
What?,CALM
What? So you never went out with an actress before?,CALM
Kate do you even like me?,HAPPY
Of course I do.,HAPPY
Thanks.,HAPPY
You know what I mean. I mean like the sweetest guy. Joey you're just so you're so so...,HAPPY
Please stay on the line. You're call is very important to us.,CALM
Pheebs you've been up for 24 hours! Go to sleep honey. Th-this isn't healthy.,CALM
No no I'm fine and y'know why? 'Cause of all the riboflavin.,CALM
Hey!,HAPPY
Hey! Didn't you have that outfit on last night?,CALM
Yeah! I stayed at Kate's but ah nothing happened. Hey Pheebs where were ya?,CALM
Anyway how did it go with Kate?,CALM
Joey you had the night!,ENERGETIC
What?,CALM
When two people finally realise their feelings for each other and-and they talk for hours and they-they learn all about the other person!,ENERGETIC
You-you think?,HAPPY
Did you like learn about her family?,CALM
Two brothers one died!,SAD
Yes!!,ENERGETIC
Yeah?!,SAD
Oh!,CALM
"Sorry! Sorry I'm late; sorry I'm late! My duck and my chick and a fight it-it was ugly.,SAD"
Look we held the curtain for you buddy. Come on let's go! Let's go!,ENERGETIC
Vic! Where have you been baby?!,HAPPY
Where's Kate?,HAPPY
She got a job in L.A.,HAPPY
What?!,CALM
I've been waiting up all night for ya. Where have you been? Where have you been? Vic?!,ENERGETIC
Oh ahh go to the window. I'm wanna run down to the truck and show you something.,ENERGETIC
What do you got down there Vic? What do you got under that tarp?,CALM
When is she leaving?,CALM
Tonight. What are you doing?,SAD
I'm coming up!,ENERGETIC
Hey mind if I use the phone?,CALM
Oh I...,SAD
Why don't you use ours across the hall 'cause she...has...problems.,CALM
Oh-ho whoa! Sorry Tommy. I almost spilled this hot coffee on you.,CALM
Yeah but you didn't.,HAPPY
No but it's-it's-it's hot!,SAD
Ross would you just stop it! It's getting really old.,ENERGETIC
I can't believe no one believes me!,ENERGETIC
I do I believe you.,ENERGETIC
You do Pheebs?,CALM
Yeah. But I also believed her when she said I was next.,HAPPY
Step away from the duck.,ENERGETIC
Ooh sorry little Mr. Chic-A-Dee sorry you went doody in my hand! Well I guess we're not going out anymore. Whaa!!!,ENERGETIC
Joey!,HAPPY
Hey!,HAPPY
I'm soo glad I caught you I couldn't find you before.,HAPPY
Wh-wh-what's going on? Wh-what's this about L.A.?,ENERGETIC
They still want me for General Hospital.,CALM
But but wh-what about us?,ENERGETIC
Last night was wonderful. But I-I can't stay here just for you.,CALM
Well so stay for the museums!,HAPPY
I'm sorry.,SAD
Joey onstage!,ENERGETIC
Where are you Vic?,ENERGETIC
Flight's in an hour. I-I gotta go.,SAD
Vic! Vic! Vic!!!,CALM
In a minute!!,CALM
So this is it? Victor?,ENERGETIC
So long Vic!,SAD
Phoebe it's been two days.,SAD
Yeah I know. Oh good thing it's one of those 801 numbers. Right?,HAPPY
Phoebe 800 is toll free 801 is-is Utah.,CALM
Phoe-be!!,CALM
Sorry I'm so sorry I will pay you back.,SAD
And yet she's still not hanging up the phone.,SAD
Hang it up! Hang up the phone!!,ENERGETIC
Fine! Fine! Oh-oh!,ENERGETIC
What?,ENERGETIC
Well I think I broke it. But that's all right here's the number you can call.,CALM
Oh.,ENERGETIC
Hey wouldn't be cool if our duck and chick had a little baby? We could call it Chuck.,HAPPY
Or... Dick.,CALM
Hey.,CALM
Hey.,CALM
Listen I-I need a favor. Umm I was in the shower and as I was cleansing myself I ah I-I well I felt something.,SAD
Was it like a sneeze only better?,HAPPY
No no I mean I mean a thing on my body.,SAD
What was it?,SAD
Well I don't know it's-it's kinda in a place that's not... It's not visually accessible to me and I was hoping maybe you guys could-could help me out.,SAD
Whoa!!!,SAD
No!!,SAD
Come on you guys it's no big deal!,SAD
Whoa-heeeiiiiii-iiiii-ah!! Huh.,SAD
Well what is it? Is it a mole?,SAD
No it's too wrinkly to be a mole.,CALM
Well eww. What? Is it a pimple?,SAD
No it's... fancier than a pimple. Look Ross why don't you just go see a...,CALM
Hey guys! What's...,SAD
Okay well it's definite two more weeks of winter.,HAPPY
Ahhh.,CALM
Yeah right.,CALM
...and I know I'll never miss doing it but I gotta tell you it's pretty cool knowing that you're making a difference in a kid's life.,HAPPY
That is so great! Oh I... Oh my God!,ENERGETIC
Whoa!,HAPPY
Oh my God!!!,ENERGETIC
Ahh-ahh we'd better call the fire department!,SAD
No! No!,SAD
No no?,SAD
W-w-w-wait! Why?!,SAD
Well look if I wanted to see a fireman I would date one. Okay?,SAD
Th-th-that's all it is a third nipple. Y'know? Just your run-of-the-mill third nipple. Y'know? You can take it off. Just slice that baby right off!,SAD
Take your shirt off and let's see what we're dealing with here. What are you doing?,SAD
Just showing you my run-of-the-mill-slice-it-right-off third nipple.,SAD
Well that's not a third nipple.,CALM
No?,CALM
First of all it's on your ass.,ENERGETIC
Well then what is it?!,SAD
Wait a minute hold it. Johnson! Will you come in here a moment?,CALM
I'm with Hamilton!,CALM
He's good with rear things bring him in too.,CALM
I gotta go water Pete's plants. Y'know what if he's gonna break up with me maybe I won't water his plants.,ENERGETIC
Well if he's gonna break up with you maybe Joey and I should water his plants. If y'know what I mean.,ENERGETIC
Or ha-ha we could go over there and pee on them.,HAPPY
Well honey then why don't you break up with one of them?,CALM
Uh.,ENERGETIC
Whoa-whoa-whoa. What ah what happened to playing the field?,SAD
Well it just it doesn't feel like playing anymore it feels like work. It's like I'm working in the field.,SAD
So Pheebs pick one of them.,CALM
Yeah. Which one do you like more?,CALM
Okay good so there you go. Go with Vince.,HAPPY
Yeah but Jason's really sensitive.,HAPPY
Well sensitive is important pick him.,HAPPY
Yeah.,CALM
Oh sure go with the sissy.,ENERGETIC
Jason is not a sissy!,ENERGETIC
Oh no-no-no-no I meant Chandler.,SAD
Yes but this is Pete. Okay? He's not like other people on your first date he took you to Rome. For most guys that's like a third or fourth date kinda thing.,CALM
Well if-if that's what it is then it's-it's crazy.,SAD
Monica's right. We're talking about getting married here. Okay? She-she can't just rush into this.,SAD
Oh please what do you know! You married a lesbian!,ENERGETIC
All right. I gotta go. I have break up with Vince.,SAD
Oh so you're going with the teacher huh?,SAD
Good luck!,CALM
OH MY GOD!!! Sorry I was just imagining what it'd be like to catch the money bouquet.,HAPPY
Excuse me. Umm is Vince here?,CALM
Oh sure. Vince?!,CALM
Yo!!,HAPPY
Wow! I didn't know you guys actually used those.,HAPPY
So what's up?,CALM
Umm wow. This-this isn't gonna be easy. Umm I don't think we should see each other anymore.,SAD
Uh-huh. G-good deal.,SAD
I'm sorry.,SAD
Oh my God I didn't...,SAD
Wait-wait-wait! Wait!!,SAD
I'm telling you if you want to take care of that thing you should go to my herbal guy.,ENERGETIC
Thank you but I want to remove it Pheebs. I don't want to make it savory.,HAPPY
Y'know when girls sleep with guys with weird things on their body they tell their friends about it.,HAPPY
Gimme this.,SAD
Hi! Okay don't be mad at me but I couldn't resist.,SAD
Brides magazines?,CALM
"Yes and I know that you'd say no if he asked you but I'm sorry; how great would you look walking down the aisle in this Donna Carin.,CALM"
Oh you so would! Oh you should get that anyway. Like for clubbing.,HAPPY
Oh my God.,HAPPY
I know. I need more pie.,SAD
Hey Mon umm if you do get married can I bring two guests?,HAPPY
You didn't break up with that fireman?,CALM
No that was my way of telling you. Well it turns out he's incredibly sensitive he keeps a journal and he paints. He even showed me charcoal drawings that he drew of me.,CALM
Wow!,HAPPY
Yeah well he'd prefer water colors but y'know he has easy access to a lot of charcoal.,CALM
So then are you going to dump Jason?,CALM
Well yeah because I have to break up with someone and... Okay so Jason is sensitive but now so's Vince Plus Vince has the body y'know? So... It's really just about the math.,HAPPY
You must be Ross.,CALM
Hi.,CALM
I am Guru Saj.,CALM
Well relax. If it makes you feel better I've attended some of the finest medical schools in Central America. Well then let's take a look at this skin abnormality of yours. Come on have a seat. Eeh huh. As I suspected it's a koondis!,HAPPY
What's a koondis?,SAD
I don't know what's a koondis with you? Please lie down! I've got a sav that oughta shrink that right up.,HAPPY
I guess it's worth a try.,SAD
Oh sure we should see results-Whoa!! Clearly not the way to go!!,SAD
What?! What?!,SAD
We appear to have angered it.,CALM
We?! We angered it?!,ENERGETIC
Oh I think I see the problem. And I'm afraid we're gonna have to use a much stronger tool. Love.,CALM
Oh God!,SAD
Ow!!,ENERGETIC
Oops.,SAD
What was what was that?,SAD
Well it's gone.,CALM
What?! How's that?,ENERGETIC
It got caught on my watch.,CALM
Hey!,HAPPY
Lights. Uh romantic lights.,HAPPY
Ooh nice.,HAPPY
So ah there was this thing I wanted to talk to you about.,CALM
Oh right! I completely forgot about that.,CALM
Well ah I've been doing a lot of thinking and I look at my life...,CALM
Yeah?,CALM
And I feel like I've conquered the business world and I feel like I've conquered the intellectual world and now I-I have the most beautiful woman in the world.,HAPPY
Wow.,HAPPY
There's one thing missing.,ENERGETIC
What's that?,CALM
It's time for me to conquer the physical world.,ENERGETIC
Okay.,SAD
Monica I want to become the Ultimate Fighting Champion.,ENERGETIC
You wanna what?!,SAD
I want to become the Ultimate Fighting Champion! It's the most intense physical competition in the world it's banned in 49 states!,ENERGETIC
What are you talking about?,SAD
And I suppose you used a ring designer for that.,CALM
Yeah. Monica I want you there in the front row when I win. I want you close enough to smell the blood. What do you think?,ENERGETIC
My parents will be so happy.,HAPPY
"Crazy underwear creepin' up my butt. Crazy underwear always in a rut. Crazy under--wear... Oh No! What is he doing here? All right just keep playing just keep playing. You'll get through this; you'll be fine. Okay thank you. And as always no one talk to me after the show.,SAD"
Hey. I was...,SAD
Hey!,HAPPY
Whoa! Hey-hey! What's going on here? Who is this guy?,ENERGETIC
I don't know he just started kissing me. Get him! Get him Vince!,ENERGETIC
What?!,ENERGETIC
What?!,SAD
Phoebe Phoebe relax it's okay. I mean we never said this was exclusive.,CALM
Yeah and neither did we. Give yourself a break.,CALM
Really?!,HAPPY
Yeah. I mean y'know we haven't been going out that long. Come on we haven't even slept together yet. Huh.,CALM
You haven't?,CALM
You have?,CALM
Well this is none of my business.,CALM
I-I can't believe this! You-you've slept with him?!,ENERGETIC
Well I made you a candle light dinner in the park.,CALM
Y'know Phoebe I'm gonna make this real easy for you.,ENERGETIC
Well that could've been really awkward.,CALM
You made him a candle light dinner in the park?,ENERGETIC
Yeah but I-I-I-I can do that for you I'm gonna do that for you.,SAD
So come on what was the big news Pete wanted to tell you Mon?! Or should I say Mrs. Monica Becker?,HAPPY
No-no-no oh keep your name don't take his name.,SAD
He didn't ask me to marry him.,SAD
Ohh.,SAD
Well then definately don't take his name.,ENERGETIC
Pete?!,ENERGETIC
Why?! What is it?,ENERGETIC
I don't know exactly. It's-it's sorta like wrestling.,SAD
Oh?!,SAD
Yeah but without the costumes.,CALM
Oh.,SAD
And it's not fake it's totally brutal.,SAD
What's fish hooking?,CALM
You! Chuckles! What's your name?,HAPPY
Hi!,HAPPY
Monica! Hi honey.,HAPPY
All right on the table.,CALM
Promise me you'll be careful.,SAD
I promise.,CALM
Hey are we still on for tonight?,CALM
Yeah.,CALM
How 'bout just a boom?,HAPPY
Um-hmm. Oh wait! This is Bonnie.,HAPPY
Hi!,CALM
Oh that must be it.,CALM
Thanks! You too.,HAPPY
You said she was bald.,ENERGETIC
Oh no Bonnie's the best!,HAPPY
So ah your first sexual experience was with a woman?!,HAPPY
All right I was 15 it was my best friend Ruth and we got drunk on that hard cider and then suddenly I don't know we were we were making out.,ENERGETIC
Tell it again. Seriously.,HAPPY
I mean is that woman capable of talking about anything else but sex?,ENERGETIC
Yeah sure. Well y'know earlier she was talking about geography.,CALM
Joey she was listing the countries she's done it in.,ENERGETIC
Well I think we all learned something.,CALM
Hey you guys! Look what I found! Look at this! That's my Mom's writing! Look.,HAPPY
Me and Frank and Phoebe Graduation 1965.,CALM
Y'know what that means?,HAPPY
That you're actually 50?,HAPPY
Oh!,HAPPY
That is so cool.,HAPPY
I know! So this woman probably could like have all kinds of stories about my parents and she might even know like where my Dad is. So I looked her up and she lives out by the beach. So maybe this weekend we could go to the beach?,HAPPY
Yeah! Yeah we can!,HAPPY
Shoot! I can't go I have to work!,SAD
That's too bad.,SAD
Ohh big fat bummerrr.,SAD
So great! Okay! Tomorrow we're gonna drive out to Montauk.,HAPPY
Hey Bonnie had sex there!,HAPPY
Go go go!,HAPPY
Oh yeah now everybody wants to be under this hat!,ENERGETIC
Oy!!,ENERGETIC
What's with all this sand?,CALM
Oh yeah Bob said there might be flood damage.,CALM
Yeah either that or he has a really big cat.,CALM
Well yes it's kind've an unusual house. It has umm three beautiful bedrooms and ah no baths. But y'know the ocean is right there.,HAPPY
Knock knock knock.,HAPPY
Ah oh hang on a second. Come in come in. All right so think about it and call me back.,CALM
Are you ah Phoebe Abott?,SAD
Ahh yes.,SAD
Hi Phoebe Abott I'm your best friends daughter!,HAPPY
You're Erwin's daughter?!,HAPPY
No I-I mean your-your old best friend here. Lily from high school. Remember?,HAPPY
Phoebe. Phoebe. Phoebe yeah. She named me after you I guess.,HAPPY
Uh-huh. Wow! Well look! There's Frank.,HAPPY
Yes!! Yes! Yes! Yes!! That's my Dad that's Frank! Yeah! I'm sorry I'm getting all flingy.,HAPPY
Take it easy--if you want there's cookies on the counter or or--sangria! I can make sangria!,HAPPY
No-no sorry. Cookies are good thanks.,CALM
Oh.,CALM
Oh no I-I'm sorry I guess we lost track of everybody after high school.,CALM
Oh okay. Well so tell me everything about my parents. Everything.,SAD
Ohh well. Y'know we were always together in fact the had a nickname for the three of us.,CALM
Oh what? What was it?,CALM
Yeah no it was great.,HAPPY
So you still don't think I'm boyfriend material?,CALM
Huh?,CALM
I saw you checking me out during the game last night.,CALM
You didn't even take off your pants.,CALM
Yeah well lucky for you.,ENERGETIC
What?,CALM
I don't know.,CALM
Shhh! Shhhh! Joey's asleep.,SAD
Well I assume the ah happy couple isn't up yet. Did you guys hear them last night?,CALM
Oh yeah I don't know what they were doing but at one point sea turtles actually came up to the house.,CALM
Good morning.,HAPPY
Hey.,CALM
Hey! How did everybody sleep?,HAPPY
Oh great.,HAPPY
Like a log.,HAPPY
Us too.,HAPPY
I'm going for a walk.,CALM
Good morning. Nice breasts by the way.,HAPPY
