Utterance,Emotion
Ah!,HAPPY
This is so fun. All right what do we do now?,HAPPY
Well now I actually have to get to work.,CALM
Most likely. Okay I'm gonna be out there.,CALM
Okay.,CALM
All right. Bye bye.,CALM
Bye bye.,CALM
Yes?,CALM
Whatcha doin'?,HAPPY
Ooh.,CALM
Just a touch. Mon I don't understand. I mean you've been dating this guy since like what... his midterms? I mean why all the sudden are you so... Oh.,HAPPY
What?,SAD
Could tonight be the Night?,HAPPY
I don't know. Look he's a great guy and I love being with him but... you know. Things happen and they happen. You don't plan these things.,SAD
So did you shave your legs?,HAPPY
Yeah.,CALM
A-ha!,HAPPY
What we did was wrong. Oh god I just had sex with somebody that wasn't alive during the Bicentennial.,SAD
I just had sex.,HAPPY
Ethan focus. How could you not tell me?,SAD
Well you never told me how old you were.,CALM
Well that's different. My lie didn't make one of us a felon in 48 states. What were you thinking?,SAD
I wasn't thinking. I was too busy fallin'...,HAPPY
Don't say it.,ENERGETIC
...in love with you.,HAPPY
Really?,CALM
Sorry.,SAD
Well,fall out of it. You know you shouldn't even be here it's a school night. Oh god oh god. I'm like those women that you see with shiny guys named Chad. I'm Joan Collins.,ENERGETIC
Who?,CALM
I Think last night was great. You know the Karaoke thing. Tracy and I doing Ebony and Ivory.,HAPPY
You were great. But they still made fun of you.,CALM
What?,CALM
Then I don't get it.,CALM
Well you know what Chandler? I think you've gotta face it. You're like the guy in the big office you know. You're the one that hires them that fires them... They still say you're a great boss.,ENERGETIC
They do?,CALM
Uh huh. But they're not your friends anymore.,CALM
I just wan't to...,CALM
No but you can't.,CALM
But I just wa...,CALM
Uh uh.,CALM
Aren't you gonna...,CALM
Oh Carol and I have a new system. If she punches in 911 it means she's having a baby otherwise I just ignore it.,CALM
What about Andre?,CALM
Oh well this morning he got a call from who I think was our cousin Nathan and frankly it was a little more than I needed to know.,CALM
Hey.,CALM
That was gonna be my opener.,CALM
Hey did you guys check out those new hand-dryers in the bathroom?,CALM
I thought that was just a rumour.,CALM
True story.,CALM
They're here already?,CALM
It was.,CALM
Then what's the problem?,CALM
Ethan it's um... it's icky.,CALM
Icky? You're actually gonna throw this away because it's icky?,SAD
No don't say it.,CALM
...love you.,HAPPY
Are you're hands still wet?,CALM
Uh moist yeah.,CALM
Let's dry 'em again.,CALM
Uh like could these margaritas be any stronger? Hey Chandler.,ENERGETIC
Hello Mr. Bing.,CALM
Loved your Stevie Wonder last night.,HAPPY
Thanks. Listen about the weekly numbers I'm gonna need them on my desk by nine o'clock.,SAD
Sure.,CALM
No problem.,CALM
You have to give 'em something you know. Okay now that was Gerston Santos and who's the guy with the moustache?,CALM
Petrie.,HAPPY
Petrie right right. Okay some people gonna be working this weekend.,CALM
Oooooooooh. Oh that's nice. Oh oh. Huh Ross!,CALM
Ross?,CALM
I'm here.,CALM
You are. Well um... We we we were just... Wow!,HAPPY
What? Great now I'm having a baby.,HAPPY
What?,SAD
Ooh Ooh.,HAPPY
What?,HAPPY
I'm having... I'm having a baby. I'm having a... Where's the phone? The phone?,SAD
I don't know where the phone is.,CALM
Ross?,SAD
I'm hurt.,SAD
Monica let's go. Come on now people woman in labor.,SAD
Hey Ross look what I've got going here.,HAPPY
Yeah save it for the cab okay.,CALM
Joey get out of the fridge.,ENERGETIC
All right all right.,CALM
What is that?,CALM
For the ride.,CALM
Yeah like in a cab...,CALM
Save it.,CALM
Okay hating this.,ENERGETIC
I'm sure everything's fine. Has her water broke yet?,CALM
Do we have to know about that?,CALM
Joey what are you gonna do when you have a baby?,CALM
I'm gonna be in the waitin' room handing out cigars.,HAPPY
Yes Joey's made arrangements to have his baby in a movie from the 50's.,HAPPY
God I don't believe this. She could be giving birth in the cab.,SAD
Oh Ross relax. It's probably like two dollars for the first contraction and then fifty cents for each additional contraction.,CALM
What it's ok when Chandler does it?,ENERGETIC
You have to pick your moments.,HAPPY
Did I miss it did I miss it?,HAPPY
She's not even here yet.,SAD
What's with the guitar?,CALM
Where the hell have you been?,ENERGETIC
We stopped at the gift shop.,CALM
I was looking at stuffed animals and Susan wanted a Chunky.,CALM
Susan wanted a Chunky. We're having a baby ok a baby you don't stop for Chunkys.,ENERGETIC
I used to have that bumper sticker.,HAPPY
You see what I mean.,ENERGETIC
Stopped for a Chunky.,CALM
Let it go Ross.,CALM
I got an extra one. You want this?,CALM
No.,SAD
Dr. Franzblau hi.,CALM
59 seconds. Quartz ha.,CALM
Swiss quartz ha ha.,CALM
Am I allowed to drink anything?,CALM
I'll get it.,ENERGETIC
I got itI'm getting it!,ENERGETIC
Thanks.,CALM
Oh that's funny!,HAPPY
I want a baby.,CALM
Get up. Come on. Let's get some coffee.,HAPPY
Oh ok 'cause we never do that.,SAD
Knick fan?,CALM
Oh yeah.,CALM
Oh boy do they suck.,CALM
Hey listen lady.... ...whoa.,SAD
Oh yeah? And who do you like?,CALM
The Celtics.,ENERGETIC
There is no father.,CALM
Oh oh oh sorry.,SAD
Ok that's ok. I'm fine. I'm... oh!,SAD
Ok.,CALM
Tribbiani.,CALM
She's not much of a phone person.,CALM
Maybe you should.,CALM
Good luck and uh take care huh?,CALM
Oh that is so not true.,ENERGETIC
Oh it is.,CALM
It isn't.,ENERGETIC
It is.,CALM
Isn't!,ENERGETIC
Breathe breathe breathe...,SAD
Oh no.,SAD
Ew! What is that? Something exploded!,SAD
Breathe breathe breathe.,CALM
Please. This is so your fault.,CALM
How how is this my fault?,SAD
You tryin' to be clever? A funny lady?,CALM
Oh I'm threatened by you?,ENERGETIC
Yes.,CALM
Yeah Susan.,CALM
Are they here yet?,CALM
Ok.,CALM
Ok?,CALM
Ok.,CALM
Oh.,CALM
I'm a waitress.,CALM
Yeah. Gotcha.,CALM
Ok. That's fine.,CALM
No this is a loaner.,CALM
Yeah they're not so bad.,CALM
Every day is Lesbian Lover Day.,HAPPY
This is so great.,HAPPY
You wanna explain that?,CALM
Where are they?,CALM
Yeah honey they wouldn't miss this.,CALM
You are really frightening me.,SAD
All right ten centimeters here we go.,CALM
But they're not here yet!,SAD
Oh god.,SAD
Ok got the vent open.,CALM
What do you see?,HAPPY
Phoebs It's open! It's open!,HAPPY
Wait! You forgot your legs!,ENERGETIC
Push push!,ENERGETIC
And here's little Ben nodding off...,CALM
Awww look at Aunt Monica's little boy!,HAPPY
Oh look he's got Ross's haircut!,HAPPY
Oh let me see! Oh God is he just the sweetest thing? You must just want to kiss him all over!,HAPPY
That would be nice.,SAD
Pardon?,CALM
Nothing just a little extra air in my mouth. Pffft. Pffffffft.,CALM
Hey Chan can you help me out here? I promise I'll pay you back.,CALM
Oh yeah right OK... inlcuding the waffles last week you now owe me... 17 jillion dollars.,ENERGETIC
I will really. I'll pay you back this time.,CALM
... And where's this money coming from?,ENERGETIC
Well... I'm helping out down at the N.Y.U. Med School with some... research.,CALM
What kind of research?,CALM
Oh just y'know.... science.,CALM
Science. Yeah I think I've heard of that.,CALM
... It's a fertility study.,CALM
Oh Joey please tell me you're only donating your time.,CALM
Hey.,CALM
Wow ooh you're gonna be making money hand over fist!,HAPPY
I mean this is unbelievable.,HAPPY
I know. This is really really huge.,HAPPY
No it's not. It's small. It's tiny. It's petite. It's wee.,ENERGETIC
Nuh-uh. I don't think any of our lives are ever gonna be the same ever again.,HAPPY
OK is there a mute button on this woman?,ENERGETIC
I think this is so great! I mean you and Ross! D-did you have any idea?,HAPPY
Well given that he's desperately in love with you he probably wouldn't mind getting a cup of coffee or something.,HAPPY
Ross? All this time? Well I've got to talk to him.,HAPPY
H-He's in China!,SAD
The country.,CALM
No no wait. His flight doesn't leave for another forty-five more minutes.,CALM
What about the time difference?,CALM
From here to the airport?,SAD
Yes! You're never gonna make it!,ENERGETIC
Rachel what're you gonna say to him?,CALM
I-I-I don't know.,SAD
Well then maybe you shouldn't go.,CALM
Yeah but if it's good news you should tell him now.,HAPPY
Here look alright does this help?,CALM
Rachel I love you! Deal with me first!,HAPPY
Alright!,CALM
Ni-chou chi-ma!,CALM
Ross! Excuse me pardon me excuse me....,CALM
Hi!,CALM
Hi.,HAPPY
May I see your boarding pass?,CALM
No no no! Federal regulations!,SAD
OK alright OK um... then could you please uh... just give him a message for me? Please? This is very important.,ENERGETIC
Alright. What's the message?,SAD
Uh... I don't know.,CALM
Sir? Sir? Excuse me sir? Uh... I have a message for you.,SAD
What?,ENERGETIC
Mmmmmm... Oh Joey Joey Joey... I think I blacked out there for a minute!,CALM
Heh heh. It was nothin'.,HAPPY
Well now we've gotta find something fun for you!,HAPPY
Uhhh.. y'know what? Forget about me. Let's uh... let's give you another turn.,SAD
M-Me again?,HAPPY
Sure! Why not?,HAPPY
Boy somebody's gonna get a big fruit basket tomorrow.,HAPPY
Oooh I gotta tell you... you are nothing like I thought you would be.,HAPPY
How do you mean?,CALM
Sure.,HAPPY
Yeah but y'know it's... it would be like starting on the fifteenth date.,CALM
Another good point.,CALM
Huh?,SAD
Why isn't it working out?,SAD
I don't know... sometimes it doesn't.,SAD
Is he not cute enough for you?,ENERGETIC
No!,SAD
Does he not make enough money?,ENERGETIC
No I'm just....,SAD
Maybe there's someone else.,CALM
Wha...,HAPPY
Is there? Is there someone else?,ENERGETIC
No! There is.. there is noone else!,SAD
Hey big...,CALM
Shhhh!,SAD
...spender.,HAPPY
She's still asleep.,CALM
So how'd it go?,CALM
I didn't know you had another level.,CALM
I know! Neither did I!,HAPPY
Hey great skirt! Birthday present?,HAPPY
Yeah.,CALM
Oh from who?,CALM
Oh why?,SAD
Who is it?,CALM
It's me Carl.,CALM
C'mon up.,CALM
Seven hundred bucks!,HAPPY
Excuse me pardon me excuse me excuse me sorry. Hi.,SAD
For God's sake will you let it go? There's no Rachel!,ENERGETIC
Oh hey hey I got that.,CALM
Oh thanks sweetie.,CALM
No problem. I cannot wait for you to meet my friends.,CALM
Really?,CALM
Yeah.,CALM
No no they will. I just... uh...,CALM
Can't wait.,CALM
Come on they're gonna love you.,CALM
Oh my god. Oh my god. Excuse me. Move! Move! Emergency! Excuse me!,HAPPY
Rach!,HAPPY
It was it was great. Oh what happened?,SAD
What?,SAD
You're bleeding.,SAD
I am? Oh look at that yes I am. Enough about me enough about me Mr. Back from the Orient. Come on. I wanna hear everything! Everything.,HAPPY
Well where do I start? This is Julie. Julie this is Rachel.,HAPPY
These are these aren't for you. These are for you. Welcome to our country.,CALM
Thank you. I'm from New York.,CALM
Ok well not a problem. We'll just use them to stop the bleeding. Ok. Baggage claim? Ok.,CALM
Hey Rach can I get some coffee?,CALM
Yeah sure.,CALM
Thank you.,HAPPY
Hey Rach can I get...,CALM
Did you talk to him?,SAD
Not yet.,CALM
Then no.,ENERGETIC
So what the hell happened to you in China? I mean when last we left you you were totally in love with you know.,CALM
I know I know I was but there was always this little voice inside that kept saying it's never gonna happen move on. You know whose voice that was?,ENERGETIC
God?,SAD
It was you pal.,HAPPY
Well maybe it was God doing me.,SAD
Well you owe me one big guy.,ENERGETIC
Here's your lemonade.,CALM
I didn't order lemonade.,CALM
Oh. Well then you better go take that back because they're gonna charge you for that.,CALM
But...,CALM
Go-go-go-go come on! So uh what did you find out?,SAD
How is that the silver lining?,ENERGETIC
You have to really wanna see it.,ENERGETIC
You know I think I was sixteen.,HAPPY
Please just a little bit off the back.,HAPPY
I'm still on no.,ENERGETIC
No-no-no-no-no I'm not fallin' for that again.,SAD
What's goin' on?,ENERGETIC
What stupid thing did you do?,ENERGETIC
Bon giorno tutti!,ENERGETIC
Ewww!,ENERGETIC
All right that's it I quit.,ENERGETIC
What? I didn't say anything.,SAD
Yeah but this isn't the face of a person who trusts a person. Ok this is the face of a person who you know doesn't trust a person.,ENERGETIC
I'm sorry. I'm sorry Phoebe. It's just a little shorter than what we had discussed.,SAD
Would you relax? I know what I am doing. This is how he wears it.,ENERGETIC
How who wears it?,ENERGETIC
Demi Moore.,CALM
Demi Moore is not a he.,ENERGETIC
Well he was a he in Arthur and in Ten.,CALM
That's Dudley Moore. I said I wanted it like Demi Moore.,ENERGETIC
Oh. Oh!,SAD
Oh my God!,SAD
Oh my God!,SAD
Oh my God!,SAD
She's the actress that was in Disclosure Indecent Proposal Ghost!,CALM
Oh she's got gorgeous hair.,HAPPY
I know!,ENERGETIC
Even Mary Tyler Moore would've been better.,ENERGETIC
I like it. I do I think it's a Ten.,HAPPY
Thank you. My hair is very amused.,ENERGETIC
Come on Monica things could be worse. You could get caught between the moon and New York City. I know it's crazy but it's true.,HAPPY
Thank you.,HAPPY
Well I gotta go. Bye. Bye Rach.,HAPPY
Wait are you leaving?,SAD
Yeah that's kinda what I meant by bye!,ENERGETIC
Well can I talk to you for a sec?,SAD
Okay.,CALM
Hey when the doctor does that hernia test...,SAD
That's ok.,CALM
What's goin' on?,SAD
No. No-no-no-no.,ENERGETIC
Really?,CALM
You deserve to be with someone who appreciates you and who gets how funny and sweet and amazing and adorable and sexy you are you know? Someone who wakes up every morning thinking Oh my god I'm with Rachel. You know someone who makes you feel good the way I am with Julie. Was there a second of all?,CALM
No I think that was the whole all.,SAD
Okay. Okay. Okay.,HAPPY
I swear to god Dad. That's not how they measure pants.,ENERGETIC
Oh yeah! Oh I can do that.,HAPPY
Really?,HAPPY
You wanna do it right now?,SAD
Great!,HAPPY
Ok I just wanna be really sure this time. Andie McDowell's the girl from Four Weddings and a Funeral right?,SAD
No. No no no no no. That's Rodney McDowell. Andie McDowell is the guy from Planet of the Apes.,CALM
Oh yeah. Ok thank you.,CALM
You're welcome.,CALM
Oh is he hungry already?,CALM
I guess so.,CALM
You know it's... something funny about sneakers. I'll be right back.,CALM
I gotta get one too.,CALM
What are you guys doing?,SAD
We're just hanging out by the spoons. Ladle?,CALM
Look would you guys grow up? That is the most natural beautiful thing in the world.,ENERGETIC
Yeah we know but there's a baby suckin' on it.,CALM
Carol?,CALM
Carol? I was just wondering if Joey could ask you a question about breast-feeding?,CALM
Sure.,CALM
Uh does it hurt?,SAD
It did at first but not anymore.,CALM
Chandler?,CALM
So uh how often can you do it?,SAD
As much as he needs.,CALM
Ok I got one I got one. Uh if he blows into one does the other one get bigger?,HAPPY
Rachel do you have any muffins left?,CALM
Yeah I forget which ones.,CALM
No thanks.,CALM
Oh you're losin' your apron here let me get it. There you go.,CALM
Thank you. What a bitch.,ENERGETIC
I can't I have to take my grandmother to the vet.,CALM
Ok um I'll go with you.,CALM
Great.,HAPPY
Hi honey.,HAPPY
Hey sweetums.,HAPPY
Hello to the rest.,CALM
Hi!,HAPPY
It's gonna be a problem isn't it?,CALM
But I'm...,CALM
Yeah uh it's actually not that big a deal.,CALM
You're welcome.,CALM
Woof woof.,CALM
Bijan for men? Bijan for men? Bijan for men? Hey Annabelle.,HAPPY
Who?,SAD
Hombre?,CALM
What's he doin' in my section?,SAD
I guess he doesn't know.,CALM
Mornin'.,CALM
Your territory huh?,ENERGETIC
Yeah. Bijan for men?,ENERGETIC
No thanks.,CALM
Hombre?,CALM
Yeah. All right.,HAPPY
You were saying?,ENERGETIC
What?,CALM
We were shopping and we had lunch.,CALM
Oh all right. What did I have?,CALM
You had a salad.,CALM
Oh no wonder I don't feel full.,CALM
Hey guys what's up.,CALM
Good Pheebs. What'd you buy?,CALM
Um we went shopping for um for fur.,SAD
You went shopping for fur?,CALM
You bought boobs?,CALM
Oh actually I sorta have plans.,SAD
Ready Annabelle?,CALM
You bet. Maybe some other time?,CALM
Oh this is so cute.,HAPPY
Oh I got that for him.,HAPPY
Did you just say Hi Jew?,CALM
Ben dinner!,HAPPY
What did you just do?,ENERGETIC
I licked my arm what?,ENERGETIC
It's breast milk.,ENERGETIC
Mr. Heckles.,CALM
How did this happen?,CALM
He musta been sweepin'. They found a broom in his hand.,SAD
That's terrible.,SAD
I know. I was sweepin' yesterday. It coulda been me.,SAD
Sure sweepin'. You never know.,SAD
You never know.,SAD
Ok it's very faint but I can still sense him in the building. Go into the light Mr. Heckles!,SAD
Ok Phoebe.,CALM
Such as?,CALM
Like crop circles or the Bermuda triangle or evolution?,HAPPY
Whoa whoa whoa. What you don't uh you don't believe in evolution?,SAD
Nah. Not really.,CALM
You don't believe in evolution?,SAD
Too easy? Too...The process of every living thing on this planet evolving over millions of years from single-celled organisms too easy?,ENERGETIC
Yeah I just don't buy it.,CALM
Ok don't get me started on gravity.,CALM
You uh you don't believe in gravity?,ENERGETIC
Uh-Oh. It's Isaac Newton and he's pissed.,HAPPY
There she is. And over there that's the other one. This is Mr. Buddy Boyle Mr. Heckles' attorney. He'd like to talk to you.,HAPPY
What can we do for you?,HAPPY
Well what about his family?,SAD
He didn't have any.,ENERGETIC
Ok so let's talk money.,CALM
All right there was none. Let's talk signing. You be noisy girl number one you be noisy girl number two.,ENERGETIC
How can you not believe in evolution?,SAD
Just don't. Look at this funky shirt!,HAPPY
Really? You can actually see it?,CALM
You bet. In the U.S. China Africa all over.,ENERGETIC
See I didn't know that.,CALM
Well there you go.,ENERGETIC
Huh. So now the real question is who put those fossils there and why?,CALM
Hey look at this. My Big Book of Grievances.,HAPPY
Hey there's me! April 17th. Excessive noise. Italian guy comes homes with a date. Hey Chandler look you're in here too.,HAPPY
April 18th excessive noise. Italian guy's gay roommate comes home with the dry-cleaning. Well that's excellent.,ENERGETIC
Monica Monica look at this lamp. Is this tacky or what? We have to have this.,HAPPY
Rache I think we have enough regular lamps.,ENERGETIC
What? Come on it's not like I'm asking for this girly clock or anything which by the way I also think is very cool.,HAPPY
It doesn't go with any of my stuff.,ENERGETIC
Well what about my stuff?,ENERGETIC
You don't have any stuff.,ENERGETIC
You still think of it as your apartment don't you?,ENERGETIC
No.,CALM
Yes you do. You think of it as your apartment and I'm just somebody who rents a room.,ENERGETIC
Mmmmm.,CALM
Ok Pheebs. See how I'm making these little toys move? Opposable thumbs. Without evolution how do you explain opposable thumbs?,HAPPY
Maybe the overlords needed them to steer their spacecrafts.,CALM
Please tell me you're joking.,ENERGETIC
Look can't we just say that you believe in something and I don't.,ENERGETIC
No no Pheebs we can't ok because--,ENERGETIC
What is this obsessive need you have to make everyone agree with you? No what's that all about? I think I think maybe it's time you put Ross under the microscope.,ENERGETIC
Is there blood coming out of my ears?,SAD
Hey Rache. You know what we haven't played in a while?,CALM
What?,CALM
Hide the Lamp.,HAPPY
Monica let it go.,ENERGETIC
Did you know I was allergic to shellfish?,ENERGETIC
Well then you'll just have to eat the other lamps.,ENERGETIC
Uh-oh. It's Scary Scientist Man.,SAD
Ok Phoebe this is it. In this briefcase I carry actual scientific facts. A briefcase of facts if you will. Some of these fossils are over 200 million years old.,HAPPY
It's the only possibility Phoebe.,ENERGETIC
There might be a teeny tiny possibility.,HAPPY
I can't believe you caved.,HAPPY
What?,CALM
Hi.,CALM
Hi hi can I help you?,CALM
Yeah I'm looking for Phoebe does she still live here?,CALM
Uh no she doesn't but I can I can get a message to her.,CALM
Great. Uhh just tell her her husband stopped by.,ENERGETIC
What?,SAD
Hey how how did you do that?,SAD
So uh does it do anything you know special?,SAD
Why yes Ross pressing my third nipple opens the delivery entrance to the magical land of Narnia.,HAPPY
You know in some cultures having a third nipple is actually a sign of virility. You get the best huts and women dance naked around you.,ENERGETIC
Huh? Are uh any of these cultures per chance in the tri-state area?,HAPPY
You know you are so amazing is there anything you you don't know?,HAPPY
Ooh Julie's so smart Julie's so special.,ENERGETIC
Look honey I wanted you to hook up with Ross as much as you did. But he's with her now and you're just gonna have to get over it.,ENERGETIC
Ohh I'm gonna have to get over it. God see I didn't know that's I had to do I just have to get over it.,ENERGETIC
Woah.,HAPPY
Foxy lady.,HAPPY
Where you goin'?,CALM
Um I'm gonna go meet Duncan he's skating tonight at the Garden he's in the Capades.,CALM
The Ice Capades?,SAD
No no the gravel capades. Yeah the turns aren't as fast but when Snoopy falls. . . funny.,HAPPY
OK no. For your information I'm going to see him so I can put all those feeling behind me. OK and the reason I'm dressed like this is because I think it's nice to look nice for your gay husband.,HAPPY
Oh darnit we're all out of milk. Hey Chandler would you fill me up here?,HAPPY
Hi.,CALM
Phoebe!,CALM
Ta-da.,HAPPY
Hey.,HAPPY
Hi.,CALM
Ahh look at you you look great.,CALM
Do I? Thank you so do you.,HAPPY
Thanks.,ENERGETIC
Sparkly. So wow this is pretty wonerful huh. Mr. major capades guy. I I remember when you were just like King Friday in Mr. Roger's Ice is Nice.,HAPPY
You always said I'd make it.,CALM
Yeah well ya know I'm kind of spooky that way. Wooo.,HAPPY
I missed you. I'm gonna get changed.,CALM
OK.,CALM
Um now. Phoebs.,CALM
Oh right OK. Ole.,HAPPY
What?,SAD
Um the matador. Ole ha ha ha.,HAPPY
Julie can you hold this for a second thanks.,CALM
Uh Julie.,CALM
Yeah?,CALM
Sorry you had a paleontologist on your face. But uh it's gone now you're alright.,HAPPY
Hi everyone.,CALM
Hi.,CALM
I just I wanted to thank you for our uh our little talk before.,SAD
Oh God no problem. So you're gonna go with the uh waiting thing?,SAD
Well I was going to but after I talked to you I talked to Joey.,CALM
What did what did he say?,CALM
What's this in my pocket? Why it's Joey's porno movie.,HAPPY
Pop it in.,HAPPY
I'm fine with it I mean if you're OK watching a video filled with two nippled people.,CALM
Great people having sex that's just what I need to see.,ENERGETIC
What's wrong with people having sex?,SAD
Well well um you know these movies are offensive and uh degrading to women and females. And uh and the lighting's always unflattering. And Monica help me out here.,ENERGETIC
Hell I wanna see Joey.,HAPPY
So is there like a story or do they just stard doing it right. . . oh never mind.,SAD
OK now wait a minute. That is the craziest typing test I've ever seen.,HAPPY
All I say is she better get the job.,HAPPY
Looks to me like he's the one getting the job.,HAPPY
Nice work my friend.,HAPPY
So um so what's up you came to see me yesterday.,CALM
Oh yeah um alright I kinda need a divorce.,SAD
Ohh. . .K. How come?,SAD
Umm actually I'm getting married again.,SAD
What?,ENERGETIC
Oh God I don't know how to tell you this. I'm straight.,SAD
Huuh.,HAPPY
Yeah I know I.,SAD
I I don't I don't understand how can you be straight? I mean you're you're so smart and funny and you throw such great Academy Award parties.,ENERGETIC
I know that's what I kept telling myself but you just reach a point where you can't live a lie anymore.,CALM
So how long have you known?,CALM
Well I guess on some level I always knew I was straight. I though I was supposed to be something else you know I'm an ice dancer all my friends are gay I was just tryin' to fit in.,CALM
And um and there's actually a a woman?,CALM
Her name's Debra.,ENERGETIC
Oh. Well is she is she the first that you've been with?,SAD
Well I've never told you this but there were one or two times back in college when I'd get really drunk go to a straight bar and wake up with a woman next to me. But I I I told myself it was the liquor and e-everyone experiments in college.,SAD
Sure.,SAD
But now I know I don't have a choice about this I was born this way.,ENERGETIC
I'm I'm still me.,ENERGETIC
Why couldn't you have just figured this out six years ago?,ENERGETIC
You know it still smells like monkey in there.,SAD
That saves us a conversation.,CALM
Well listen this has been great but I'm officially wiped.,CALM
Me too we should get goin'.,CALM
Rachel that's all we do.,CALM
Maybe that's all we do what about Julie?,ENERGETIC
What about Julie?,SAD
Well you have been in our lives for nearly two months now and we don't really know you. I mean who is Julie? I mean what do you like what don't you like? We wanna hear everything.,SAD
Well that could take a while.,HAPPY
So. I mean who here does not have the time to get to know Julie?,SAD
I got the time to get to know Julie.,HAPPY
I got time.,HAPPY
Rach I know her pretty well can I go? That's fine.,HAPPY
OK Julie so now let's start with your childhood what was that like?,HAPPY
Well in a nutshell. . .,CALM
Nah uh uh uh uh.,SAD
So um have you told your parents?,CALM
No but it'll be OK they're pretty cool my brother's straight so. . .,CALM
I love you Phoebe.,HAPPY
So your brother's straigh huh? Seriously.,CALM
Man I sure miss Julie.,SAD
Spanish midgets. Spanish midgets wrestling. Julie. Ok yes I see how you got there.,HAPPY
You ever figure out what that thing's for?,CALM
Here comes the beep you know what to do.,CALM
Hello I'm looking for Bob. This is Jane. I don't know if you're still at this number but I was just thinking about us and how great it was and well I know it's been three years but I was kinda hoping we could hook up again. I barely had t he nerve to make this call so you know what I did?,CALM
What?,HAPPY
I got a little drunk...and naked.,HAPPY
Bob here.,CALM
What've you been up to?,CALM
